{
  "scenarioId": "056ee372-f316-46d6-b5a3-e23200f09430",
  "missionType": "hostage_rescue",
  "layout": {
    "rooms": [
      {
        "id": "room_01",
        "type": "entry",
        "position": {
          "x": 0.0,
          "y": 0.0,
          "z": 0.0
        },
        "size": {
          "width": 8.0,
          "depth": 8.0,
          "height": 3.0
        },
        "connectedRoomIds": [
          "room_02",
          "room_03"
        ],
        "doors": [
          {
            "id": "door_01_02",
            "connectsToRoomId": "room_02",
            "position": {
              "x": 5.0,
              "y": 0.0,
              "z": 0.0
            },
            "wallSide": "east"
          },
          {
            "id": "door_01_03",
            "connectsToRoomId": "room_03",
            "position": {
              "x": 0.0,
              "y": 0.0,
              "z": 5.0
            },
            "wallSide": "north"
          }
        ],
        "depth": 0,
        "zoneLabel": "Entry Hall"
      },
      {
        "id": "room_02",
        "type": "hostage_room",
        "position": {
          "x": 10.0,
          "y": 0.0,
          "z": 0.0
        },
        "size": {
          "width": 8.0,
          "depth": 8.0,
          "height": 3.0
        },
        "connectedRoomIds": [
          "room_01"
        ],
        "doors": [
          {
            "id": "door_01_02",
            "connectsToRoomId": "room_01",
            "position": {
              "x": 5.0,
              "y": 0.0,
              "z": 0.0
            },
            "wallSide": "west"
          }
        ],
        "depth": 1,
        "zoneLabel": "Back Office"
      },
      {
        "id": "room_03",
        "type": "hostage_room",
        "position": {
          "x": 0.0,
          "y": 0.0,
          "z": 10.0
        },
        "size": {
          "width": 8.0,
          "depth": 8.0,
          "height": 3.0
        },
        "connectedRoomIds": [
          "room_01"
        ],
        "doors": [
          {
            "id": "door_01_03",
            "connectsToRoomId": "room_01",
            "position": {
              "x": 0.0,
              "y": 0.0,
              "z": 5.0
            },
            "wallSide": "south"
          }
        ],
        "depth": 1,
        "zoneLabel": "Front Room"
      }
    ],
    "entryPoints": [
      {
        "id": "entry_main",
        "roomId": "room_01",
        "position": {
          "x": -5.0,
          "y": 0.0,
          "z": 0.0
        },
        "facingDirection": {
          "x": 1.0,
          "y": 0.0,
          "z": 0.0
        }
      }
    ],
    "layoutMetadata": {
      "totalRooms": 3,
      "layoutType": "hub_and_spoke",
      "maxDepth": 1,
      "graphDiameter": 2,
      "roomSizeCategory": "large",
      "entryType": "single",
      "boundingBox": {
        "min": {
          "x": -5.0,
          "y": 0.0,
          "z": -4.0
        },
        "max": {
          "x": 14.0,
          "y": 3.0,
          "z": 14.0
        }
      }
    }
  },
  "spawnPoints": {
    "trainee": {
      "roomId": "room_01",
      "position": {
        "x": 0.0,
        "y": 0.0,
        "z": 0.0
      },
      "facingDirection": {
        "x": 1.0,
        "y": 0.0,
        "z": 0.0
      }
    },
    "hostages": [
      {
        "entityId": "hostage_01",
        "roomId": "room_03",
        "position": {
          "x": -0.351567924,
          "y": 0.0,
          "z": 10.1501513
        },
        "facingDirection": {
          "x": -0.4123041,
          "y": 0.0,
          "z": 0.911046267
        }
      }
    ],
    "terrorists": [
      {
        "entityId": "terrorist_01",
        "roomId": "room_03",
        "position": {
          "x": -3.2,
          "y": 0.0,
          "z": 9.54888248
        },
        "facingDirection": {
          "x": 0.5753653,
          "y": 0.0,
          "z": -0.8178966
        }
      },
      {
        "entityId": "terrorist_02",
        "roomId": "room_03",
        "position": {
          "x": -0.434297949,
          "y": 0.0,
          "z": 13.2
        },
        "facingDirection": {
          "x": 0.0528890379,
          "y": 0.0,
          "z": -0.9986004
        }
      },
      {
        "entityId": "terrorist_03",
        "roomId": "room_03",
        "position": {
          "x": -3.2,
          "y": 0.0,
          "z": 13.2
        },
        "facingDirection": {
          "x": 0.363542527,
          "y": 0.0,
          "z": -0.9315777
        }
      },
      {
        "entityId": "terrorist_04",
        "roomId": "room_03",
        "position": {
          "x": -1.59868419,
          "y": 0.0,
          "z": 6.8
        },
        "facingDirection": {
          "x": 0.6640584,
          "y": 0.0,
          "z": -0.747680664
        }
      }
    ]
  },
  "entities": [
    {
      "id": "trainee_01",
      "type": "trainee",
      "assignedRoom": "room_01",
      "position": {
        "x": 0.0,
        "y": 0.0,
        "z": 0.0
      },
      "metadata": {
        "initialState": "idle"
      }
    },
    {
      "id": "hostage_01",
      "type": "hostage",
      "assignedRoom": "room_03",
      "position": {
        "x": -0.351567924,
        "y": 0.0,
        "z": 10.1501513
      },
      "metadata": {
        "initialState": "calm"
      }
    },
    {
      "id": "terrorist_01",
      "type": "terrorist",
      "assignedRoom": "room_03",
      "position": {
        "x": -3.2,
        "y": 0.0,
        "z": 9.54888248
      },
      "metadata": {
        "initialState": "idle"
      }
    },
    {
      "id": "terrorist_02",
      "type": "terrorist",
      "assignedRoom": "room_03",
      "position": {
        "x": -0.434297949,
        "y": 0.0,
        "z": 13.2
      },
      "metadata": {
        "initialState": "idle"
      }
    },
    {
      "id": "terrorist_03",
      "type": "terrorist",
      "assignedRoom": "room_03",
      "position": {
        "x": -3.2,
        "y": 0.0,
        "z": 13.2
      },
      "metadata": {
        "initialState": "idle"
      }
    },
    {
      "id": "terrorist_04",
      "type": "terrorist",
      "assignedRoom": "room_03",
      "position": {
        "x": -1.59868419,
        "y": 0.0,
        "z": 6.8
      },
      "metadata": {
        "initialState": "idle"
      }
    }
  ],
  "roleAssignments": [
    {
      "entityId": "terrorist_01",
      "role": "hostage_guardian",
      "priorityLevel": 1,
      "assignedRoomId": "room_03",
      "navigationContextId": "nav_terrorist_01"
    },
    {
      "entityId": "terrorist_02",
      "role": "patrol",
      "priorityLevel": 3,
      "assignedRoomId": "room_03",
      "navigationContextId": "nav_terrorist_02"
    },
    {
      "entityId": "terrorist_03",
      "role": "roaming_guard",
      "priorityLevel": 2,
      "assignedRoomId": "room_03",
      "navigationContextId": "nav_terrorist_03"
    },
    {
      "entityId": "terrorist_04",
      "role": "roaming_guard",
      "priorityLevel": 2,
      "assignedRoomId": "room_03",
      "navigationContextId": "nav_terrorist_04"
    }
  ],
  "navigationContext": {
    "nav_terrorist_01": {
      "type": "hostage_guardian",
      "guardedEntityId": "hostage_01",
      "hostageRoomId": "room_03",
      "guardPosition": {
        "x": -3.2,
        "y": 0.0,
        "z": 9.54888248
      },
      "facingDirection": {
        "x": 0.5753653,
        "y": 0.0,
        "z": -0.8178966
      }
    },
    "nav_terrorist_02": {
      "type": "patrol",
      "patrolRoute": [
        "room_03",
        "room_03"
      ],
      "looping": true,
      "waypoints": [
        {
          "x": 0.0,
          "y": 0.0,
          "z": 10.0
        },
        {
          "x": 0.0,
          "y": 0.0,
          "z": 10.0
        }
      ]
    },
    "nav_terrorist_03": {
      "type": "roaming_guard",
      "roamingRoomIds": [
        "room_03"
      ],
      "anchorRoomId": "room_03",
      "waypoints": [
        {
          "x": 0.0,
          "y": 0.0,
          "z": 10.0
        },
        {
          "x": 0.0,
          "y": 0.0,
          "z": 10.0
        }
      ]
    },
    "nav_terrorist_04": {
      "type": "roaming_guard",
      "roamingRoomIds": [
        "room_03"
      ],
      "anchorRoomId": "room_03",
      "waypoints": [
        {
          "x": 0.0,
          "y": 0.0,
          "z": 10.0
        },
        {
          "x": 0.0,
          "y": 0.0,
          "z": 10.0
        }
      ]
    }
  },
  "configurationMetadata": {
    "scenarioConfig": {
      "schemaVersion": "1.0.0",
      "missionStructure": {
        "missionType": "hostage_rescue",
        "roomCount": {
          "min": 3,
          "max": 5
        },
        "roomSize": "large",
        "layoutType": "hub_and_spoke",
        "entryType": "single"
      },
      "entityConfiguration": {
        "hostageCount": 1,
        "terroristCount": 4,
        "placementStrategy": "clustered",
        "hostageRiskLevel": "high"
      },
      "executionControls": {
        "difficultyLevel": 3,
        "randomnessLevel": "low",
        "seed": null,
        "timeLimit": null,
        "customLabel": null
      }
    },
    "generationTimestamp": "2026-05-04T02:45:09.2621143Z",
    "seedUsed": 55684968,
    "generatorVersion": "1.0.0",
    "validationResult": {
      "passed": true,
      "checksRun": 10,
      "checksPassed": 10,
      "warnings": []
    }
  }
}