{
  "scenarioId": "a1b2c3d4-e5f6-7890-abcd-ef1234567890",
  "missionType": "hostage_rescue",

  "layout": {
    "rooms": [
      {
        "id": "room_01",
        "type": "entry",
        "position": { "x": 0.0, "y": 0.0, "z": 0.0 },
        "size": { "width": 6.0, "depth": 6.0, "height": 3.0 },
        "connectedRoomIds": ["room_02", "room_03"],
        "doors": [
          { "id": "door_01_02", "connectsToRoomId": "room_02", "position": { "x": 3.0, "y": 0.0, "z": 0.0 }, "wallSide": "east" },
          { "id": "door_01_03", "connectsToRoomId": "room_03", "position": { "x": 0.0, "y": 0.0, "z": 3.0 }, "wallSide": "north" }
        ],
        "depth": 0,
        "zoneLabel": "Entry Hall"
      },
      {
        "id": "room_02",
        "type": "standard",
        "position": { "x": 8.0, "y": 0.0, "z": 0.0 },
        "size": { "width": 6.0, "depth": 6.0, "height": 3.0 },
        "connectedRoomIds": ["room_01", "room_04"],
        "doors": [
          { "id": "door_02_01", "connectsToRoomId": "room_01", "position": { "x": 5.0, "y": 0.0, "z": 0.0 }, "wallSide": "west" },
          { "id": "door_02_04", "connectsToRoomId": "room_04", "position": { "x": 11.0, "y": 0.0, "z": 0.0 }, "wallSide": "east" }
        ],
        "depth": 1,
        "zoneLabel": "East Corridor"
      },
      {
        "id": "room_03",
        "type": "standard",
        "position": { "x": 0.0, "y": 0.0, "z": 8.0 },
        "size": { "width": 6.0, "depth": 6.0, "height": 3.0 },
        "connectedRoomIds": ["room_01", "room_05"],
        "doors": [
          { "id": "door_03_01", "connectsToRoomId": "room_01", "position": { "x": 0.0, "y": 0.0, "z": 5.0 }, "wallSide": "south" },
          { "id": "door_03_05", "connectsToRoomId": "room_05", "position": { "x": 0.0, "y": 0.0, "z": 11.0 }, "wallSide": "north" }
        ],
        "depth": 1,
        "zoneLabel": "North Wing"
      },
      {
        "id": "room_04",
        "type": "standard",
        "position": { "x": 16.0, "y": 0.0, "z": 0.0 },
        "size": { "width": 6.0, "depth": 6.0, "height": 3.0 },
        "connectedRoomIds": ["room_02", "room_06"],
        "doors": [
          { "id": "door_04_02", "connectsToRoomId": "room_02", "position": { "x": 13.0, "y": 0.0, "z": 0.0 }, "wallSide": "west" },
          { "id": "door_04_06", "connectsToRoomId": "room_06", "position": { "x": 19.0, "y": 0.0, "z": 0.0 }, "wallSide": "east" }
        ],
        "depth": 2,
        "zoneLabel": "Storage Room"
      },
      {
        "id": "room_05",
        "type": "standard",
        "position": { "x": 0.0, "y": 0.0, "z": 16.0 },
        "size": { "width": 6.0, "depth": 6.0, "height": 3.0 },
        "connectedRoomIds": ["room_03"],
        "doors": [
          { "id": "door_05_03", "connectsToRoomId": "room_03", "position": { "x": 0.0, "y": 0.0, "z": 13.0 }, "wallSide": "south" }
        ],
        "depth": 2,
        "zoneLabel": "North Dead End"
      },
      {
        "id": "room_06",
        "type": "hostage_room",
        "position": { "x": 24.0, "y": 0.0, "z": 0.0 },
        "size": { "width": 6.0, "depth": 6.0, "height": 3.0 },
        "connectedRoomIds": ["room_04"],
        "doors": [
          { "id": "door_06_04", "connectsToRoomId": "room_04", "position": { "x": 21.0, "y": 0.0, "z": 0.0 }, "wallSide": "west" }
        ],
        "depth": 3,
        "zoneLabel": "Back Office"
      }
    ],

    "entryPoints": [
      {
        "id": "entry_main",
        "roomId": "room_01",
        "position": { "x": -3.0, "y": 0.0, "z": 0.0 },
        "facingDirection": { "x": 1.0, "y": 0.0, "z": 0.0 }
      }
    ],

    "layoutMetadata": {
      "totalRooms": 6,
      "layoutType": "branching",
      "maxDepth": 3,
      "graphDiameter": 5,
      "roomSizeCategory": "medium",
      "entryType": "single",
      "boundingBox": {
        "min": { "x": -3.0, "y": 0.0, "z": -3.0 },
        "max": { "x": 27.0, "y": 3.0, "z": 19.0 }
      }
    }
  },

  "spawnPoints": {
    "trainee": {
      "roomId": "room_01",
      "position": { "x": -1.0, "y": 0.0, "z": 0.0 },
      "facingDirection": { "x": 1.0, "y": 0.0, "z": 0.0 }
    },
    "hostages": [
      {
        "entityId": "hostage_01",
        "roomId": "room_06",
        "position": { "x": 25.0, "y": 0.0, "z": 1.0 },
        "facingDirection": { "x": -1.0, "y": 0.0, "z": 0.0 }
      }
    ],
    "terrorists": [
      {
        "entityId": "terrorist_01",
        "roomId": "room_02",
        "position": { "x": 9.0, "y": 0.0, "z": -1.5 },
        "facingDirection": { "x": -1.0, "y": 0.0, "z": 0.0 }
      },
      {
        "entityId": "terrorist_02",
        "roomId": "room_03",
        "position": { "x": 1.0, "y": 0.0, "z": 9.0 },
        "facingDirection": { "x": 0.0, "y": 0.0, "z": -1.0 }
      },
      {
        "entityId": "terrorist_03",
        "roomId": "room_04",
        "position": { "x": 17.5, "y": 0.0, "z": -2.0 },
        "facingDirection": { "x": -1.0, "y": 0.0, "z": 0.0 }
      },
      {
        "entityId": "terrorist_04",
        "roomId": "room_06",
        "position": { "x": 23.0, "y": 0.0, "z": 0.5 },
        "facingDirection": { "x": -1.0, "y": 0.0, "z": 0.0 }
      }
    ]
  },

  "entities": [
    {
      "id": "trainee_01",
      "type": "trainee",
      "assignedRoom": "room_01",
      "position": { "x": -1.0, "y": 0.0, "z": 0.0 },
      "metadata": {}
    },
    {
      "id": "hostage_01",
      "type": "hostage",
      "assignedRoom": "room_06",
      "position": { "x": 25.0, "y": 0.0, "z": 1.0 },
      "metadata": { "initialState": "calm" }
    },
    {
      "id": "terrorist_01",
      "type": "terrorist",
      "assignedRoom": "room_02",
      "position": { "x": 9.0, "y": 0.0, "z": -1.5 },
      "metadata": { "initialState": "idle" }
    },
    {
      "id": "terrorist_02",
      "type": "terrorist",
      "assignedRoom": "room_03",
      "position": { "x": 1.0, "y": 0.0, "z": 9.0 },
      "metadata": { "initialState": "idle" }
    },
    {
      "id": "terrorist_03",
      "type": "terrorist",
      "assignedRoom": "room_04",
      "position": { "x": 17.5, "y": 0.0, "z": -2.0 },
      "metadata": { "initialState": "idle" }
    },
    {
      "id": "terrorist_04",
      "type": "terrorist",
      "assignedRoom": "room_06",
      "position": { "x": 23.0, "y": 0.0, "z": 0.5 },
      "metadata": { "initialState": "idle" }
    }
  ],

  "roleAssignments": [
    {
      "entityId": "terrorist_01",
      "role": "patrol",
      "priorityLevel": 3,
      "assignedRoomId": "room_02",
      "navigationContextId": "nav_terrorist_01"
    },
    {
      "entityId": "terrorist_02",
      "role": "roaming_guard",
      "priorityLevel": 2,
      "assignedRoomId": "room_03",
      "navigationContextId": "nav_terrorist_02"
    },
    {
      "entityId": "terrorist_03",
      "role": "stationary_guard",
      "priorityLevel": 2,
      "assignedRoomId": "room_04",
      "navigationContextId": "nav_terrorist_03"
    },
    {
      "entityId": "terrorist_04",
      "role": "hostage_guardian",
      "priorityLevel": 1,
      "assignedRoomId": "room_06",
      "navigationContextId": "nav_terrorist_04"
    }
  ],

  "navigationContext": {
    "nav_terrorist_01": {
      "type": "patrol",
      "patrolRoute": ["room_02", "room_01", "room_02"],
      "waypoints": [
        { "x": 9.0, "y": 0.0, "z": -1.5 },
        { "x": 5.0, "y": 0.0, "z": 0.0 },
        { "x": 1.0, "y": 0.0, "z": 0.0 },
        { "x": 5.0, "y": 0.0, "z": 0.0 },
        { "x": 9.0, "y": 0.0, "z": -1.5 }
      ],
      "looping": true
    },
    "nav_terrorist_02": {
      "type": "roaming_guard",
      "roamingRoomIds": ["room_03", "room_05"],
      "waypoints": [
        { "x": 1.0, "y": 0.0, "z": 9.0 },
        { "x": 0.0, "y": 0.0, "z": 13.0 },
        { "x": 1.0, "y": 0.0, "z": 17.0 },
        { "x": 0.0, "y": 0.0, "z": 13.0 },
        { "x": 1.0, "y": 0.0, "z": 9.0 }
      ],
      "anchorRoomId": "room_03"
    },
    "nav_terrorist_03": {
      "type": "stationary_guard",
      "guardRoomId": "room_04",
      "guardPosition": { "x": 17.5, "y": 0.0, "z": -2.0 },
      "facingDirection": { "x": -1.0, "y": 0.0, "z": 0.0 }
    },
    "nav_terrorist_04": {
      "type": "hostage_guardian",
      "guardedEntityId": "hostage_01",
      "hostageRoomId": "room_06",
      "guardPosition": { "x": 23.0, "y": 0.0, "z": 0.5 },
      "facingDirection": { "x": -1.0, "y": 0.0, "z": 0.0 }
    }
  },

  "configurationMetadata": {
    "scenarioConfig": {
      "schemaVersion": "1.0.0",
      "missionStructure": {
        "missionType": "hostage_rescue",
        "roomCount": { "min": 6, "max": 10 },
        "roomSize": "medium",
        "layoutType": "branching",
        "entryType": "single"
      },
      "entityConfiguration": {
        "hostageCount": 1,
        "terroristCount": 4,
        "placementStrategy": "deep",
        "hostageRiskLevel": "high"
      },
      "executionControls": {
        "difficultyLevel": 4,
        "randomnessLevel": "medium",
        "seed": 20260419,
        "timeLimit": 600,
        "customLabel": "Session_Alpha_Week3_Eval2"
      }
    },
    "generationTimestamp": "2026-04-19T14:30:00Z",
    "seedUsed": 20260419,
    "generatorVersion": "1.0.0",
    "validationResult": {
      "passed": true,
      "checksRun": 6,
      "checksPassed": 6,
      "warnings": []
    }
  }
}
