{
  "scenarioId": "40a843ab-12d9-4eba-b06b-b9546b7991f5",
  "missionType": "hostage_rescue",
  "layout": {
    "rooms": [
      {
        "id": "room_01",
        "type": "entry",
        "position": {
          "x": 0.0,
          "y": 0.0,
          "z": 0.0
        },
        "size": {
          "width": 6.0,
          "depth": 6.0,
          "height": 3.0
        },
        "connectedRoomIds": [
          "room_02"
        ],
        "doors": [
          {
            "id": "door_01_02",
            "connectsToRoomId": "room_02",
            "position": {
              "x": 0.0,
              "y": 0.0,
              "z": 4.0
            },
            "wallSide": "north",
            "state": "open",
            "isExterior": false
          }
        ],
        "depth": 0,
        "zoneLabel": "Entry Hall"
      },
      {
        "id": "room_02",
        "type": "corridor",
        "position": {
          "x": 0.0,
          "y": 0.0,
          "z": 8.0
        },
        "size": {
          "width": 6.0,
          "depth": 6.0,
          "height": 3.0
        },
        "connectedRoomIds": [
          "room_01",
          "room_03"
        ],
        "doors": [
          {
            "id": "door_01_02",
            "connectsToRoomId": "room_01",
            "position": {
              "x": 0.0,
              "y": 0.0,
              "z": 4.0
            },
            "wallSide": "south",
            "state": "open",
            "isExterior": false
          },
          {
            "id": "door_02_03",
            "connectsToRoomId": "room_03",
            "position": {
              "x": 4.0,
              "y": 0.0,
              "z": 8.0
            },
            "wallSide": "east",
            "state": "locked",
            "isExterior": false
          }
        ],
        "depth": 1,
        "zoneLabel": "Front Room"
      },
      {
        "id": "room_03",
        "type": "hostage_room",
        "position": {
          "x": 8.0,
          "y": 0.0,
          "z": 8.0
        },
        "size": {
          "width": 6.0,
          "depth": 6.0,
          "height": 3.0
        },
        "connectedRoomIds": [
          "room_02"
        ],
        "doors": [
          {
            "id": "door_02_03",
            "connectsToRoomId": "room_02",
            "position": {
              "x": 4.0,
              "y": 0.0,
              "z": 8.0
            },
            "wallSide": "west",
            "state": "locked",
            "isExterior": false
          }
        ],
        "depth": 2,
        "zoneLabel": "Back Office"
      }
    ],
    "entryPoints": [
      {
        "id": "entry_main",
        "roomId": "room_01",
        "position": {
          "x": -4.0,
          "y": 0.0,
          "z": 0.0
        },
        "facingDirection": {
          "x": 1.0,
          "y": 0.0,
          "z": 0.0
        }
      }
    ],
    "layoutMetadata": {
      "totalRooms": 3,
      "layoutType": "branching",
      "maxDepth": 2,
      "graphDiameter": 2,
      "roomSizeCategory": "medium",
      "entryType": "single",
      "boundingBox": {
        "min": {
          "x": -4.0,
          "y": 0.0,
          "z": -3.0
        },
        "max": {
          "x": 11.0,
          "y": 3.0,
          "z": 11.0
        }
      }
    }
  },
  "spawnPoints": {
    "trainee": {
      "roomId": "room_01",
      "position": {
        "x": 0.0,
        "y": 0.0,
        "z": 0.0
      },
      "facingDirection": {
        "x": 1.0,
        "y": 0.0,
        "z": 0.0
      }
    },
    "hostages": [
      {
        "entityId": "hostage_01",
        "roomId": "room_03",
        "position": {
          "x": 8.145261,
          "y": 0.0,
          "z": 8.048653
        },
        "facingDirection": {
          "x": -0.7772293,
          "y": 0.0,
          "z": -0.629217446
        }
      }
    ],
    "terrorists": [
      {
        "entityId": "terrorist_01",
        "roomId": "room_02",
        "position": {
          "x": 0.169673383,
          "y": 0.0,
          "z": 8.010573
        },
        "facingDirection": {
          "x": 0.9999962,
          "y": 0.0,
          "z": -0.00276042963
        }
      },
      {
        "entityId": "terrorist_02",
        "roomId": "room_03",
        "position": {
          "x": 8.654987,
          "y": 0.0,
          "z": 5.8
        },
        "facingDirection": {
          "x": -0.904112756,
          "y": 0.0,
          "z": 0.427293926
        }
      },
      {
        "entityId": "terrorist_03",
        "roomId": "room_02",
        "position": {
          "x": -2.2,
          "y": 0.0,
          "z": 7.42960835
        },
        "facingDirection": {
          "x": 0.5399327,
          "y": 0.0,
          "z": -0.8417081
        }
      }
    ]
  },
  "entities": [
    {
      "id": "trainee_01",
      "type": "trainee",
      "assignedRoom": "room_01",
      "position": {
        "x": 0.0,
        "y": 0.0,
        "z": 0.0
      },
      "metadata": {
        "initialState": "idle"
      }
    },
    {
      "id": "hostage_01",
      "type": "hostage",
      "assignedRoom": "room_03",
      "position": {
        "x": 8.145261,
        "y": 0.0,
        "z": 8.048653
      },
      "metadata": {
        "initialState": "calm"
      }
    },
    {
      "id": "terrorist_01",
      "type": "terrorist",
      "assignedRoom": "room_02",
      "position": {
        "x": 0.169673383,
        "y": 0.0,
        "z": 8.010573
      },
      "metadata": {
        "initialState": "idle"
      }
    },
    {
      "id": "terrorist_02",
      "type": "terrorist",
      "assignedRoom": "room_03",
      "position": {
        "x": 8.654987,
        "y": 0.0,
        "z": 5.8
      },
      "metadata": {
        "initialState": "idle"
      }
    },
    {
      "id": "terrorist_03",
      "type": "terrorist",
      "assignedRoom": "room_02",
      "position": {
        "x": -2.2,
        "y": 0.0,
        "z": 7.42960835
      },
      "metadata": {
        "initialState": "idle"
      }
    }
  ],
  "roleAssignments": [
    {
      "entityId": "terrorist_02",
      "role": "hostage_guardian",
      "priorityLevel": 1,
      "assignedRoomId": "room_03",
      "navigationContextId": "nav_terrorist_02"
    },
    {
      "entityId": "terrorist_01",
      "role": "patrol",
      "priorityLevel": 3,
      "assignedRoomId": "room_02",
      "navigationContextId": "nav_terrorist_01"
    },
    {
      "entityId": "terrorist_03",
      "role": "stationary_guard",
      "priorityLevel": 2,
      "assignedRoomId": "room_02",
      "navigationContextId": "nav_terrorist_03"
    }
  ],
  "navigationContext": {
    "nav_terrorist_02": {
      "type": "hostage_guardian",
      "guardedEntityId": "hostage_01",
      "hostageRoomId": "room_03",
      "guardPosition": {
        "x": 8.654987,
        "y": 0.0,
        "z": 5.8
      },
      "facingDirection": {
        "x": -0.904112756,
        "y": 0.0,
        "z": 0.427293926
      }
    },
    "nav_terrorist_01": {
      "type": "patrol",
      "patrolRoute": [
        "room_02",
        "room_03",
        "room_02"
      ],
      "looping": true,
      "waypoints": [
        {
          "x": 0.0,
          "y": 0.0,
          "z": 8.0
        },
        {
          "x": 8.0,
          "y": 0.0,
          "z": 8.0
        },
        {
          "x": 0.0,
          "y": 0.0,
          "z": 8.0
        }
      ]
    },
    "nav_terrorist_03": {
      "type": "stationary_guard",
      "guardRoomId": "room_02",
      "guardPosition": {
        "x": -2.2,
        "y": 0.0,
        "z": 7.42960835
      },
      "facingDirection": {
        "x": 0.5399327,
        "y": 0.0,
        "z": -0.8417081
      }
    }
  },
  "configurationMetadata": {
    "scenarioConfig": {
      "schemaVersion": "1.0.0",
      "missionStructure": {
        "missionType": "hostage_rescue",
        "roomCount": {
          "min": 3,
          "max": 3
        },
        "roomSize": "medium",
        "layoutType": "branching",
        "entryType": "single"
      },
      "entityConfiguration": {
        "hostageCount": 1,
        "terroristCount": 3,
        "placementStrategy": "dispersed",
        "hostageRiskLevel": "medium"
      },
      "executionControls": {
        "difficultyLevel": 3,
        "randomnessLevel": "medium",
        "seed": null,
        "timeLimit": null,
        "customLabel": null
      }
    },
    "generationTimestamp": "2026-07-11T19:13:24.6671088Z",
    "seedUsed": 1580342500,
    "generatorVersion": "1.0.0",
    "validationResult": {
      "passed": true,
      "checksRun": 10,
      "checksPassed": 10,
      "warnings": []
    }
  }
}